{"checks":["strict_pairwise_report_and_embedded_score_reparsed","canonical_score_binding_recomputed","fifteen_factor_values_independently_derived_from_challenge_inputs","all_one_hundred_five_factor_pairs_reenumerated","all_four_hundred_twenty_binary_interactions_recomputed","gateway_score_and_pairwise_pass_conjunction_recomputed"],"document":{"document_sha256":"8a28b5fee4dfbb6ed54be9cf35858c985d610775196b90e6ae528a3ae07249e9","payload_base64":"eyJldmFsdWF0ZWRfYXQiOiIyMDI2LTA5LTA1VDE1OjAzOjAwWiIsImZhY3Rvcl9yb3dzIjpbeyJjYXNlX2lkIjoiY2FzZS0wMDAxIiwidmFsdWVzIjp7ImFnZW50X3BvbGljeV9hc3NpZ25tZW50Ijp0cnVlLCJhZ2VudF93b3JrbG9hZF9iaW5kaW5nIjp0cnVlLCJhcHByb3ZhbF9kZWNpc2lvbiI6dHJ1ZSwiYXBwcm92YWxfaW50ZW50X2JpbmRpbmciOnRydWUsImltcGFjdF93aXRoaW5fbGltaXQiOnRydWUsIm1pc3Npb25faXNzdWVfYmVmb3JlX2RlY2lzaW9uIjp0cnVlLCJtaXNzaW9uX3JvbGVfYXNzaWdubWVudCI6dHJ1ZSwibWlzc2lvbl91bmV4cGlyZWRfYXRfZGVjaXNpb24iOnRydWUsInJlcXVlc3Rlcl9yZWdpc3RyeV9tZW1iZXJzaGlwIjp0cnVlLCJyZXF1ZXN0ZXJfc2VwYXJhdGlvbiI6dHJ1ZSwicmVxdWlyZWRfc2VjdXJpdHlfcm9sZSI6dHJ1ZSwicnVuX2JpbmRpbmciOnRydWUsInNlY3VyaXR5X2FwcHJvdmVyX3JlZ2lzdHJ5X21lbWJlcnNoaXAiOnRydWUsInNlY3VyaXR5X3R0bF93aXRoaW5fcG9saWN5Ijp0cnVlLCJ0ZW5hbnRfYmluZGluZyI6dHJ1ZX19LHsiY2FzZV9pZCI6ImNhc2UtMDAwMiIsInZhbHVlcyI6eyJhZ2VudF9wb2xpY3lfYXNzaWdubWVudCI6dHJ1ZSwiYWdlbnRfd29ya2xvYWRfYmluZGluZyI6ZmFsc2UsImFwcHJvdmFsX2RlY2lzaW9uIjp0cnVlLCJhcHByb3ZhbF9pbnRlbnRfYmluZGluZyI6ZmFsc2UsImltcGFjdF93aXRoaW5fbGltaXQiOnRydWUsIm1pc3Npb25faXNzdWVfYmVmb3JlX2RlY2lzaW9uIjp0cnVlLCJtaXNzaW9uX3JvbGVfYXNzaWdubWVudCI6ZmFsc2UsIm1pc3Npb25fdW5leHBpcmVkX2F0X2RlY2lzaW9uIjpmYWxzZSwicmVxdWVzdGVyX3JlZ2lzdHJ5X21lbWJlcnNoaXAiOmZhbHNlLCJyZXF1ZXN0ZXJfc2VwYXJhdGlvbiI6ZmFsc2UsInJlcXVpcmVkX3NlY3VyaXR5X3JvbGUiOmZhbHNlLCJydW5fYmluZGluZyI6dHJ1ZSwic2VjdXJpdHlfYXBwcm92ZXJfcmVnaXN0cnlfbWVtYmVyc2hpcCI6dHJ1ZSwic2VjdXJpdHlfdHRsX3dpdGhpbl9wb2xpY3kiOnRydWUsInRlbmFudF9iaW5kaW5nIjpmYWxzZX19LHsiY2FzZV9pZCI6ImNhc2UtMDAwMyIsInZhbHVlcyI6eyJhZ2VudF9wb2xpY3lfYXNzaWdubWVudCI6dHJ1ZSwiYWdlbnRfd29ya2xvYWRfYmluZGluZyI6ZmFsc2UsImFwcHJvdmFsX2RlY2lzaW9uIjp0cnVlLCJhcHByb3ZhbF9pbnRlbnRfYmluZGluZyI6ZmFsc2UsImltcGFjdF93aXRoaW5fbGltaXQiOmZhbHNlLCJtaXNzaW9uX2lzc3VlX2JlZm9yZV9kZWNpc2lvbiI6dHJ1ZSwibWlzc2lvbl9yb2xlX2Fzc2lnbm1lbnQiOmZhbHNlLCJtaXNzaW9uX3VuZXhwaXJlZF9hdF9kZWNpc2lvbiI6dHJ1ZSwicmVxdWVzdGVyX3JlZ2lzdHJ5X21lbWJlcnNoaXAiOnRydWUsInJlcXVlc3Rlcl9zZXBhcmF0aW9uIjp0cnVlLCJyZXF1aXJlZF9zZWN1cml0eV9yb2xlIjpmYWxzZSwicnVuX2JpbmRpbmciOmZhbHNlLCJzZWN1cml0eV9hcHByb3Zlcl9yZWdpc3RyeV9tZW1iZXJzaGlwIjpmYWxzZSwic2VjdXJpdHlfdHRsX3dpdGhpbl9wb2xpY3kiOmZhbHNlLCJ0ZW5hbnRfYmluZGluZyI6dHJ1ZX19LHsiY2FzZV9pZCI6ImNhc2UtMDAwNCIsInZhbHVlcyI6eyJhZ2VudF9wb2xpY3lfYXNzaWdubWVudCI6dHJ1ZSwiYWdlbnRfd29ya2xvYWRfYmluZGluZyI6dHJ1ZSwiYXBwcm92YWxfZGVjaXNpb24iOnRydWUsImFwcHJvdmFsX2ludGVudF9iaW5kaW5nIjp0cnVlLCJpbXBhY3Rfd2l0aGluX2xpbWl0IjpmYWxzZSwibWlzc2lvbl9pc3N1ZV9iZWZvcmVfZGVjaXNpb24iOnRydWUsIm1pc3Npb25fcm9sZV9hc3NpZ25tZW50IjpmYWxzZSwibWlzc2lvbl91bmV4cGlyZWRfYXRfZGVjaXNpb24iOmZhbHNlLCJyZXF1ZXN0ZXJfcmVnaXN0cnlfbWVtYmVyc2hpcCI6ZmFsc2UsInJlcXVlc3Rlcl9zZXBhcmF0aW9uIjpmYWxzZSwicmVxdWlyZWRfc2VjdXJpdHlfcm9sZSI6dHJ1ZSwicnVuX2JpbmRpbmciOmZhbHNlLCJzZWN1cml0eV9hcHByb3Zlcl9yZWdpc3RyeV9tZW1iZXJzaGlwIjpmYWxzZSwic2VjdXJpdHlfdHRsX3dpdGhpbl9wb2xpY3kiOmZhbHNlLCJ0ZW5hbnRfYmluZGluZyI6ZmFsc2V9fSx7ImNhc2VfaWQiOiJjYXNlLTAwMDUiLCJ2YWx1ZXMiOnsiYWdlbnRfcG9saWN5X2Fzc2lnbm1lbnQiOmZhbHNlLCJhZ2VudF93b3JrbG9hZF9iaW5kaW5nIjp0cnVlLCJhcHByb3ZhbF9kZWNpc2lvbiI6dHJ1ZSwiYXBwcm92YWxfaW50ZW50X2JpbmRpbmciOmZhbHNlLCJpbXBhY3Rfd2l0aGluX2xpbWl0IjpmYWxzZSwibWlzc2lvbl9pc3N1ZV9iZWZvcmVfZGVjaXNpb24iOmZhbHNlLCJtaXNzaW9uX3JvbGVfYXNzaWdubWVudCI6dHJ1ZSwibWlzc2lvbl91bmV4cGlyZWRfYXRfZGVjaXNpb24iOmZhbHNlLCJyZXF1ZXN0ZXJfcmVnaXN0cnlfbWVtYmVyc2hpcCI6ZmFsc2UsInJlcXVlc3Rlcl9zZXBhcmF0aW9uIjp0cnVlLCJyZXF1aXJlZF9zZWN1cml0eV9yb2xlIjpmYWxzZSwicnVuX2JpbmRpbmciOnRydWUsInNlY3VyaXR5X2FwcHJvdmVyX3JlZ2lzdHJ5X21lbWJlcnNoaXAiOnRydWUsInNlY3VyaXR5X3R0bF93aXRoaW5fcG9saWN5IjpmYWxzZSwidGVuYW50X2JpbmRpbmciOnRydWV9fSx7ImNhc2VfaWQiOiJjYXNlLTAwMDYiLCJ2YWx1ZXMiOnsiYWdlbnRfcG9saWN5X2Fzc2lnbm1lbnQiOmZhbHNlLCJhZ2VudF93b3JrbG9hZF9iaW5kaW5nIjpmYWxzZSwiYXBwcm92YWxfZGVjaXNpb24iOnRydWUsImFwcHJvdmFsX2ludGVudF9iaW5kaW5nIjp0cnVlLCJpbXBhY3Rfd2l0aGluX2xpbWl0IjpmYWxzZSwibWlzc2lvbl9pc3N1ZV9iZWZvcmVfZGVjaXNpb24iOmZhbHNlLCJtaXNzaW9uX3JvbGVfYXNzaWdubWVudCI6ZmFsc2UsIm1pc3Npb25fdW5leHBpcmVkX2F0X2RlY2lzaW9uIjp0cnVlLCJyZXF1ZXN0ZXJfcmVnaXN0cnlfbWVtYmVyc2hpcCI6dHJ1ZSwicmVxdWVzdGVyX3NlcGFyYXRpb24iOmZhbHNlLCJyZXF1aXJlZF9zZWN1cml0eV9yb2xlIjp0cnVlLCJydW5fYmluZGluZyI6dHJ1ZSwic2VjdXJpdHlfYXBwcm92ZXJfcmVnaXN0cnlfbWVtYmVyc2hpcCI6dHJ1ZSwic2VjdXJpdHlfdHRsX3dpdGhpbl9wb2xpY3kiOmZhbHNlLCJ0ZW5hbnRfYmluZGluZyI6ZmFsc2V9fSx7ImNhc2VfaWQiOiJjYXNlLTAwMDciLCJ2YWx1ZXMiOnsiYWdlbnRfcG9saWN5X2Fzc2lnbm1lbnQiOmZhbHNlLCJhZ2VudF93b3JrbG9hZF9iaW5kaW5nIjpmYWxzZSwiYXBwcm92YWxfZGVjaXNpb24iOnRydWUsImFwcHJvdmFsX2ludGVudF9iaW5kaW5nIjp0cnVlLCJpbXBhY3Rfd2l0aGluX2xpbWl0Ijp0cnVlLCJtaXNzaW9uX2lzc3VlX2JlZm9yZV9kZWNpc2lvbiI6ZmFsc2UsIm1pc3Npb25fcm9sZV9hc3NpZ25tZW50IjpmYWxzZSwibWlzc2lvbl91bmV4cGlyZWRfYXRfZGVjaXNpb24iOmZhbHNlLCJyZXF1ZXN0ZXJfcmVnaXN0cnlfbWVtYmVyc2hpcCI6ZmFsc2UsInJlcXVlc3Rlcl9zZXBhcmF0aW9uIjp0cnVlLCJyZXF1aXJlZF9zZWN1cml0eV9yb2xlIjp0cnVlLCJydW5fYmluZGluZyI6ZmFsc2UsInNlY3VyaXR5X2FwcHJvdmVyX3JlZ2lzdHJ5X21lbWJlcnNoaXAiOmZhbHNlLCJzZWN1cml0eV90dGxfd2l0aGluX3BvbGljeSI6dHJ1ZSwidGVuYW50X2JpbmRpbmciOnRydWV9fSx7ImNhc2VfaWQiOiJjYXNlLTAwMDgiLCJ2YWx1ZXMiOnsiYWdlbnRfcG9saWN5X2Fzc2lnbm1lbnQiOmZhbHNlLCJhZ2VudF93b3JrbG9hZF9iaW5kaW5nIjp0cnVlLCJhcHByb3ZhbF9kZWNpc2lvbiI6dHJ1ZSwiYXBwcm92YWxfaW50ZW50X2JpbmRpbmciOmZhbHNlLCJpbXBhY3Rfd2l0aGluX2xpbWl0Ijp0cnVlLCJtaXNzaW9uX2lzc3VlX2JlZm9yZV9kZWNpc2lvbiI6ZmFsc2UsIm1pc3Npb25fcm9sZV9hc3NpZ25tZW50Ijp0cnVlLCJtaXNzaW9uX3VuZXhwaXJlZF9hdF9kZWNpc2lvbiI6dHJ1ZSwicmVxdWVzdGVyX3JlZ2lzdHJ5X21lbWJlcnNoaXAiOnRydWUsInJlcXVlc3Rlcl9zZXBhcmF0aW9uIjpmYWxzZSwicmVxdWlyZWRfc2VjdXJpdHlfcm9sZSI6ZmFsc2UsInJ1bl9iaW5kaW5nIjpmYWxzZSwic2VjdXJpdHlfYXBwcm92ZXJfcmVnaXN0cnlfbWVtYmVyc2hpcCI6ZmFsc2UsInNlY3VyaXR5X3R0bF93aXRoaW5fcG9saWN5Ijp0cnVlLCJ0ZW5hbnRfYmluZGluZyI6ZmFsc2V9fSx7ImNhc2VfaWQiOiJjYXNlLTAwMDkiLCJ2YWx1ZXMiOnsiYWdlbnRfcG9saWN5X2Fzc2lnbm1lbnQiOnRydWUsImFnZW50X3dvcmtsb2FkX2JpbmRpbmciOnRydWUsImFwcHJvdmFsX2RlY2lzaW9uIjpmYWxzZSwiYXBwcm92YWxfaW50ZW50X2JpbmRpbmciOnRydWUsImltcGFjdF93aXRoaW5fbGltaXQiOnRydWUsIm1pc3Npb25faXNzdWVfYmVmb3JlX2RlY2lzaW9uIjpmYWxzZSwibWlzc2lvbl9yb2xlX2Fzc2lnbm1lbnQiOmZhbHNlLCJtaXNzaW9uX3VuZXhwaXJlZF9hdF9kZWNpc2lvbiI6ZmFsc2UsInJlcXVlc3Rlcl9yZWdpc3RyeV9tZW1iZXJzaGlwIjp0cnVlLCJyZXF1ZXN0ZXJfc2VwYXJhdGlvbiI6ZmFsc2UsInJlcXVpcmVkX3NlY3VyaXR5X3JvbGUiOmZhbHNlLCJydW5fYmluZGluZyI6dHJ1ZSwic2VjdXJpdHlfYXBwcm92ZXJfcmVnaXN0cnlfbWVtYmVyc2hpcCI6ZmFsc2UsInNlY3VyaXR5X3R0bF93aXRoaW5fcG9saWN5IjpmYWxzZSwidGVuYW50X2JpbmRpbmciOnRydWV9fSx7ImNhc2VfaWQiOiJjYXNlLTAwMTAiLCJ2YWx1ZXMiOnsiYWdlbnRfcG9saWN5X2Fzc2lnbm1lbnQiOnRydWUsImFnZW50X3dvcmtsb2FkX2JpbmRpbmciOmZhbHNlLCJhcHByb3ZhbF9kZWNpc2lvbiI6ZmFsc2UsImFwcHJvdmFsX2ludGVudF9iaW5kaW5nIjpmYWxzZSwiaW1wYWN0X3dpdGhpbl9saW1pdCI6dHJ1ZSwibWlzc2lvbl9pc3N1ZV9iZWZvcmVfZGVjaXNpb24iOmZhbHNlLCJtaXNzaW9uX3JvbGVfYXNzaWdubWVudCI6dHJ1ZSwibWlzc2lvbl91bmV4cGlyZWRfYXRfZGVjaXNpb24iOnRydWUsInJlcXVlc3Rlcl9yZWdpc3RyeV9tZW1iZXJzaGlwIjpmYWxzZSwicmVxdWVzdGVyX3NlcGFyYXRpb24iOnRydWUsInJlcXVpcmVkX3NlY3VyaXR5X3JvbGUiOnRydWUsInJ1bl9iaW5kaW5nIjp0cnVlLCJzZWN1cml0eV9hcHByb3Zlcl9yZWdpc3RyeV9tZW1iZXJzaGlwIjpmYWxzZSwic2VjdXJpdHlfdHRsX3dpdGhpbl9wb2xpY3kiOmZhbHNlLCJ0ZW5hbnRfYmluZGluZyI6ZmFsc2V9fSx7ImNhc2VfaWQiOiJjYXNlLTAwMTEiLCJ2YWx1ZXMiOnsiYWdlbnRfcG9saWN5X2Fzc2lnbm1lbnQiOnRydWUsImFnZW50X3dvcmtsb2FkX2JpbmRpbmciOmZhbHNlLCJhcHByb3ZhbF9kZWNpc2lvbiI6ZmFsc2UsImFwcHJvdmFsX2ludGVudF9iaW5kaW5nIjpmYWxzZSwiaW1wYWN0X3dpdGhpbl9saW1pdCI6ZmFsc2UsIm1pc3Npb25faXNzdWVfYmVmb3JlX2RlY2lzaW9uIjpmYWxzZSwibWlzc2lvbl9yb2xlX2Fzc2lnbm1lbnQiOnRydWUsIm1pc3Npb25fdW5leHBpcmVkX2F0X2RlY2lzaW9uIjpmYWxzZSwicmVxdWVzdGVyX3JlZ2lzdHJ5X21lbWJlcnNoaXAiOnRydWUsInJlcXVlc3Rlcl9zZXBhcmF0aW9uIjpmYWxzZSwicmVxdWlyZWRfc2VjdXJpdHlfcm9sZSI6dHJ1ZSwicnVuX2JpbmRpbmciOmZhbHNlLCJzZWN1cml0eV9hcHByb3Zlcl9yZWdpc3RyeV9tZW1iZXJzaGlwIjp0cnVlLCJzZWN1cml0eV90dGxfd2l0aGluX3BvbGljeSI6dHJ1ZSwidGVuYW50X2JpbmRpbmciOnRydWV9fSx7ImNhc2VfaWQiOiJjYXNlLTAwMTIiLCJ2YWx1ZXMiOnsiYWdlbnRfcG9saWN5X2Fzc2lnbm1lbnQiOnRydWUsImFnZW50X3dvcmtsb2FkX2JpbmRpbmciOnRydWUsImFwcHJvdmFsX2RlY2lzaW9uIjpmYWxzZSwiYXBwcm92YWxfaW50ZW50X2JpbmRpbmciOnRydWUsImltcGFjdF93aXRoaW5fbGltaXQiOmZhbHNlLCJtaXNzaW9uX2lzc3VlX2JlZm9yZV9kZWNpc2lvbiI6ZmFsc2UsIm1pc3Npb25fcm9sZV9hc3NpZ25tZW50IjpmYWxzZSwibWlzc2lvbl91bmV4cGlyZWRfYXRfZGVjaXNpb24iOnRydWUsInJlcXVlc3Rlcl9yZWdpc3RyeV9tZW1iZXJzaGlwIjpmYWxzZSwicmVxdWVzdGVyX3NlcGFyYXRpb24iOnRydWUsInJlcXVpcmVkX3NlY3VyaXR5X3JvbGUiOmZhbHNlLCJydW5fYmluZGluZyI6ZmFsc2UsInNlY3VyaXR5X2FwcHJvdmVyX3JlZ2lzdHJ5X21lbWJlcnNoaXAiOnRydWUsInNlY3VyaXR5X3R0bF93aXRoaW5fcG9saWN5Ijp0cnVlLCJ0ZW5hbnRfYmluZGluZyI6ZmFsc2V9fSx7ImNhc2VfaWQiOiJjYXNlLTAwMTMiLCJ2YWx1ZXMiOnsiYWdlbnRfcG9saWN5X2Fzc2lnbm1lbnQiOmZhbHNlLCJhZ2VudF93b3JrbG9hZF9iaW5kaW5nIjp0cnVlLCJhcHByb3ZhbF9kZWNpc2lvbiI6ZmFsc2UsImFwcHJvdmFsX2ludGVudF9iaW5kaW5nIjpmYWxzZSwiaW1wYWN0X3dpdGhpbl9saW1pdCI6ZmFsc2UsIm1pc3Npb25faXNzdWVfYmVmb3JlX2RlY2lzaW9uIjp0cnVlLCJtaXNzaW9uX3JvbGVfYXNzaWdubWVudCI6ZmFsc2UsIm1pc3Npb25fdW5leHBpcmVkX2F0X2RlY2lzaW9uIjp0cnVlLCJyZXF1ZXN0ZXJfcmVnaXN0cnlfbWVtYmVyc2hpcCI6ZmFsc2UsInJlcXVlc3Rlcl9zZXBhcmF0aW9uIjpmYWxzZSwicmVxdWlyZWRfc2VjdXJpdHlfcm9sZSI6dHJ1ZSwicnVuX2JpbmRpbmciOnRydWUsInNlY3VyaXR5X2FwcHJvdmVyX3JlZ2lzdHJ5X21lbWJlcnNoaXAiOmZhbHNlLCJzZWN1cml0eV90dGxfd2l0aGluX3BvbGljeSI6dHJ1ZSwidGVuYW50X2JpbmRpbmciOnRydWV9fSx7ImNhc2VfaWQiOiJjYXNlLTAwMTQiLCJ2YWx1ZXMiOnsiYWdlbnRfcG9saWN5X2Fzc2lnbm1lbnQiOmZhbHNlLCJhZ2VudF93b3JrbG9hZF9iaW5kaW5nIjpmYWxzZSwiYXBwcm92YWxfZGVjaXNpb24iOmZhbHNlLCJhcHByb3ZhbF9pbnRlbnRfYmluZGluZyI6dHJ1ZSwiaW1wYWN0X3dpdGhpbl9saW1pdCI6ZmFsc2UsIm1pc3Npb25faXNzdWVfYmVmb3JlX2RlY2lzaW9uIjp0cnVlLCJtaXNzaW9uX3JvbGVfYXNzaWdubWVudCI6dHJ1ZSwibWlzc2lvbl91bmV4cGlyZWRfYXRfZGVjaXNpb24iOmZhbHNlLCJyZXF1ZXN0ZXJfcmVnaXN0cnlfbWVtYmVyc2hpcCI6dHJ1ZSwicmVxdWVzdGVyX3NlcGFyYXRpb24iOnRydWUsInJlcXVpcmVkX3NlY3VyaXR5X3JvbGUiOmZhbHNlLCJydW5fYmluZGluZyI6dHJ1ZSwic2VjdXJpdHlfYXBwcm92ZXJfcmVnaXN0cnlfbWVtYmVyc2hpcCI6ZmFsc2UsInNlY3VyaXR5X3R0bF93aXRoaW5fcG9saWN5Ijp0cnVlLCJ0ZW5hbnRfYmluZGluZyI6ZmFsc2V9fSx7ImNhc2VfaWQiOiJjYXNlLTAw